<?xml version="1.0" encoding="utf-8"?>
<!DOCTYPE Annotation PUBLIC "-//GENIA//DTD GENIA ANNOTATION EVENT 2.0//EN" "../GENIAtypes/GENIA_event_20.dtd">
<Annotation created="26/03/2010" creator="Tomoko Ohta" annotates="http://www.ncbi.nlm.nih.gov/entrez/eutils/efetch.fcgi?db=pubmed&amp;retmode=xml&amp;rettype=medline&amp;id=000000000">
<PubmedArticleSet>
<PubmedArticle>
<MedlineCitation>
<PMID>000000000</PMID>
<Article>
<ArticleTitle>
<sentence id="S1">Selfish DNA in Protein-Coding Genes of Rickettsia</sentence>
</ArticleTitle>
<Abstract>
<AbstractText>
<sentence id="S2">Rickettsia conorii , the aetiological agent of Mediterranean spotted fever , is an intracellular bacterium transmitted by ticks .</sentence>
<sentence id="S3">Preliminary analyses of the nearly complete genome sequence of R. conorii have revealed 44 occurrences of a previously undescribed palindromic repeat ( 150 base pairs long ) throughout the <term id="T1" sem="Cell_component">genome</term> .</sentence>
<sentence id="S4">Unexpectedly , this repeat was found inserted in-frame within 19 different R. conorii open reading frames likely to encode functional proteins .</sentence>
<sentence id="S5">We found the same repeat in proteins of other Rickettsia species .</sentence>
<sentence id="S6">The finding of a mobile element inserted in many unrelated genes suggests the potential role of selfish DNA in the creation of new protein sequences .</sentence>
</AbstractText>
</Abstract>
</Article>
</MedlineCitation>
</PubmedArticle>
</PubmedArticleSet>
</Annotation>
