<?xml version="1.0" encoding="utf-8"?>
<!DOCTYPE Annotation PUBLIC "-//GENIA//DTD GENIA ANNOTATION EVENT 2.0//EN" "../GENIAtypes/GENIA_event_20.dtd">
<Annotation created="26/03/2010" creator="Tomoko Ohta" annotates="http://www.ncbi.nlm.nih.gov/entrez/eutils/efetch.fcgi?db=pubmed&amp;retmode=xml&amp;rettype=medline&amp;id=000000000">
<PubmedArticleSet>
<PubmedArticle>
<MedlineCitation>
<PMID>000000000</PMID>
<Article>
<ArticleTitle>
<sentence id="S1">Bacterial <term id="T6" sem="Biological_process">type IV secretion</term> : <term id="T11" sem="Cell_component"><term id="T7" sem="Biological_process">conjugation</term> systems</term> adapted to deliver effector molecules to host cells</sentence>
</ArticleTitle>
<Abstract>
<AbstractText>
<sentence id="S2">Several bacterial pathogens utilize <term id="T12" sem="Cell_component">conjugation machines</term> to <term id="T8" sem="Biological_process">export</term> effector molecules during infection .</sentence>
<sentence id="S3">Such systems are members of the type IV or &apos;adapted <term id="T9" sem="Biological_process">conjugation&apos;</term> secretion family .</sentence>
<sentence id="S4">The prototypical <term id="T13" sem="Cell_component">type IV system</term> is the <term id="T1" sem="Bacterium">Agrobacterium tumefaciens</term> <term id="T14" sem="Cell_component">T-DNA transfer machine</term> , which delivers oncogenic nucleoprotein particles to plant cells .</sentence>
<sentence id="S5">Other pathogens , including <term id="T2" sem="Bacterium">Bordetella pertussis</term> , <term id="T3" sem="Bacterium">Legionella pneumophila</term> , <term id="T4" sem="Bacterium">Brucella spp</term> . and <term id="T5" sem="Bacterium">Helicobacter pylori</term> , use <term id="T15" sem="Cell_component">type IV machines</term> to <term id="T10" sem="Biological_process">export effector</term> proteins to the <term id="T16" sem="Cell_component">extracellular milieu</term> or the mammalian cell <term id="T17" sem="Cell_component">cytosol</term> .</sentence>
</AbstractText>
</Abstract>
</Article>
</MedlineCitation>
</PubmedArticle>
</PubmedArticleSet>
</Annotation>
