<?xml version='1.0'?>
<!DOCTYPE Annotation PUBLIC "-//GENIA//DTD GENIA ANNOTATION EVENT 2.0//EN" "../GENIAtypes/GENIA_event_20.dtd">
<Annotation annotates="http://www.ncbi.nlm.nih.gov/entrez/eutils/efetch.fcgi?db=pubmed&amp;retmode=xml&amp;rettype=medline&amp;id=000000000" created="26/03/2010" creator="Tomoko Ohta"><PubmedArticleSet><PubmedArticle><MedlineCitation>
<PMID>000000000</PMID>
<Article>
<ArticleTitle>
<sentence id="S1"><term id="T1" sem="Bacterium">Agrobacterium tumefaciens</term> <gene-or-gene-product id="G1">VirB11</gene-or-gene-product> Protein Requires a Consensus <term id="T17" sem="Molecular_function">Nucleotide-Binding</term> Site for Function in <term id="T8" sem="Biological_process">Virulence</term></sentence>
<relation id="R1">
<SRtype/>
<GGP idref="G1"/>
<BioTerm idref="T8"/></relation>
</ArticleTitle>
<Abstract>
<AbstractText>
<sentence id="S2"><gene-or-gene-product id="G2">virB11</gene-or-gene-product> , one of the 11 genes of the virB operon , is absolutely required for <term id="T9" sem="Biological_process">transport of T-DNA</term> from <term id="T2" sem="Bacterium">Agrobacterium tumefaciens</term> into plant cells .</sentence>
<sentence id="S3">Previous studies reported that <gene-or-gene-product id="G4">VirB11</gene-or-gene-product> is an ATPase with autophosphorylation activity and <term id="T10" sem="Biological_process">localizes</term> to the inner membrane even though the protein does not contain the consensus N-terminal export sequence .</sentence>
<sentence id="S4">In this report , we show that <gene-or-gene-product id="G6">VirB11</gene-or-gene-product> <term id="T11" sem="Biological_process">localizes</term> to the <term id="T15" sem="Cell_component">inner membrane</term> even in the absence of other tumor-inducing ( Ti ) plasmid-encoded proteins .</sentence>
<sentence id="S5">To facilitate the further characterization of <gene-or-gene-product id="G7">VirB11</gene-or-gene-product> , we purified this protein from the soluble fraction of an <term id="T3" sem="Bacterium">Escherichia coli</term> extract by fusing <gene-or-gene-product id="G8">VirB11</gene-or-gene-product> to the maltose-binding protein .</sentence>
<sentence id="S6">The <term id="T18" sem="Molecular_function">maltose-binding</term> protein <gene-or-gene-product id="G10">VirB11</gene-or-gene-product> fusion was able to complement a <gene-or-gene-product id="G11">virB11</gene-or-gene-product> deletion mutant of <term id="T4" sem="Bacterium">A. tumefaciens</term> for tumor formation and also <term id="T12" sem="Biological_process">localized</term> properly to the <term id="T16" sem="Cell_component">inner membrane</term> of <term id="T5" sem="Bacterium">A. tumefaciens</term> .</sentence>
<sentence id="S7">The 72-kDa protein , purified from <term id="T6" sem="Bacterium">E. coli</term> , exhibited no autophosphorylation , <term id="T19" sem="Molecular_function">ATPase activity</term> , or <term id="T20" sem="Molecular_function">ATP-binding activity</term> .</sentence>
<sentence id="S8">To study the importance of the Walker <term id="T21" sem="Molecular_function">nucleotide-binding</term> site present in <gene-or-gene-product id="G14">VirB11</gene-or-gene-product> , mutations were generated to replace the conserved lysine residue with either alanine or arginine .</sentence>
<sentence id="S9">Expression of the <term id="N2" sem="Protein_molecule"><gene-or-gene-product id="G15">virB11</gene-or-gene-product>K175A</term> mutant gene resulted in an <term id="T22" sem="Biological_process">avirulent</term> phenotype , and expression of the <gene-or-gene-product id="G16">virB11</gene-or-gene-product>K175R mutant gene gave rise to an attenuated <term id="T13" sem="Biological_process">virulence</term> phenotype .</sentence>
<relation id="R2">
<SRtype/>
<GGP idref="G15"/>
<BioTerm idref="T22"/></relation>
<relation id="R3">
<SRtype/>
<GGP idref="G16"/>
<BioTerm idref="T13"/></relation>
<sentence id="S10">Both mutant proteins were present at levels three to four times higher than that of <gene-or-gene-product id="G17">VirB11</gene-or-gene-product> in the wild-type strain .</sentence>
<sentence id="S11">The mutant genes did not exhibit a transdominant phenotype on tumor formation in bacteria that were expressing wild-type <gene-or-gene-product id="G18">virB11</gene-or-gene-product> .</sentence>
<sentence id="S12">The mutant proteins also <term id="T14" sem="Biological_process">localized</term> properly to the <term id="N1" sem="Cell_component">inner membrane</term> of <term id="T7" sem="Bacterium">A. tumefaciens</term> , but the <term id="N3" sem="Protein_molecule"><gene-or-gene-product id="G19">VirB11</gene-or-gene-product>K175R</term> protein appeared to be unstable after lysis of the cells .</sentence>
</AbstractText>
</Abstract></Article></MedlineCitation></PubmedArticle></PubmedArticleSet></Annotation>